"title","author","subject","abstract","date"
"allhands: ask me anything on large-scale verbatim feedback via large language models","chaoyun zhang, zicheng ma, yuhao wu, shilin he, si qin, minghua ma, xiaoting qin, yu kang, yuyi liang, xiaoyu gou, yajie xue, qingwei lin, saravan rajmohan, dongmei zhang, qi zhang","software engineering","verbatim feedback constitutes a valuable repository of user experiences, opinions, and requirements essential for software development. effectively and efficiently extracting valuable insights from such data poses a challenging task. this paper introduces allhands , an innovative analytic framework designed for large-scale feedback analysis through a natural language interface, leveraging large language models (llms). allhands adheres to a conventional feedback analytic workflow, initially conducting classification and topic modeling on the feedback to convert them into a structurally augmented format, incorporating llms to enhance accuracy, robustness, generalization, and user-friendliness. subsequently, an llm agent is employed to interpret users' diverse questions in natural language on feedback, translating them into python code for execution, and delivering comprehensive multi-modal responses, including text, code, tables, and images.
we evaluate allhands across three diverse feedback datasets. the experiments demonstrate that allhands achieves superior efficacy at all stages of analysis, including classification and topic modeling, eventually providing users with an ""ask me anything"" experience with comprehensive, correct and human-readable response. to the best of our knowledge, allhands stands as the first comprehensive feedback analysis framework that supports diverse and customized requirements for insight extraction through a natural language interface.",2024-03-22
"programmers prefer individually assigned tasks vs. shared responsibility","adela krylova, roman makarov, sergei pasynkov, yegor bugayenko","software engineering","in traditional management, tasks are typically assigned to individuals, with each worker taking full responsibility for the success or failure of a task. in contrast, modern agile, lean, and extreme programming practices advocate for shared responsibility, where an entire group is accountable for the outcome of a project or task. despite numerous studies in other domains, the preferences of programmers have not been thoroughly analyzed. to address this gap, we conducted a survey featuring seven situational questions and collected the opinions of 120 software development practitioners. our findings reveal that programmers prefer tasks to be assigned to them on an individual basis and appreciate taking personal responsibility for failures, as well as receiving individual rewards for successes. understanding these preferences is crucial for project managers aiming to optimize team dynamics and ensure the successful completion of software projects.",2024-03-22
"multi-role consensus through llms discussions for vulnerability detection","zhenyu mao, jialong li, dongming jin, munan li, kenji tei","software engineering","recent advancements in large language models (llms) have highlighted the potential for vulnerability detection, a crucial component of software quality assurance. despite this progress, most studies have been limited to the perspective of a single role, usually testers, lacking diverse viewpoints from different roles in a typical software development life-cycle, including both developers and testers. to this end, this paper introduces a multi-role approach to employ llms to act as different roles simulating a real-life code review process and engaging in discussions toward a consensus on the existence and classification of vulnerabilities in the code. preliminary evaluation of this approach indicates a 13.48% increase in the precision rate, an 18.25% increase in the recall rate, and a 16.13% increase in the f1 score.",2024-03-21
"pricing-driven development and operation of saas : challenges and opportunities","alejandro garcía-fernández, josé antonio parejo, antonio ruiz-cortés","software engineering","as the software as a service (saas) paradigm continues to reshape the software industry, a nuanced understanding of its operational dynamics becomes increasingly crucial. this paper delves into the intricate relationship between pricing strategies and software development within the saas model. using petclinic as a case study, we explore the implications of a pricing-driven development and operation approach of saas systems, highlighting the delicate balance between business-driven decision-making and technical implementation challenges, shedding light on how pricing plans can shape software features and deployment. our discussion aims to provide strategic insights for the community to navigate the complexities of this integrated approach, fostering a better alignment between business models and technological capabilities for effective cloud-based services.",2024-03-20
"quantitative analysis of ai-generated texts in academic research: a study of ai presence in arxiv submissions using ai detection tool","arslan akram","digital libraries","many people are interested in chatgpt since it has become a prominent aigc model that provides high-quality responses in various contexts, such as software development and maintenance. misuse of chatgpt might cause significant issues, particularly in public safety and education, despite its immense potential. the majority of researchers choose to publish their work on arxiv. the effectiveness and originality of future work depend on the ability to detect ai components in such contributions. to address this need, this study will analyze a method that can see purposely manufactured content that academic organizations use to post on arxiv. for this study, a dataset was created using physics, mathematics, and computer science articles. using the newly built dataset, the following step is to put this http url through its paces. the statistical analysis shows that this http url is very accurate, with a rate of 98%.",2024-02-09
"elevating software quality in agile environments: the role of testing professionals in unit testing","lucas neves, oscar campos, robson santos, italo santos, cleyton magalhaes, ronnie de souza santos","software engineering","testing is an essential quality activity in the software development process. usually, a software system is tested on several levels, starting with unit testing that checks the smallest parts of the code until acceptance testing, which is focused on the validations with the end-user. historically, unit testing has been the domain of developers, who are responsible for ensuring the accuracy of their code. however, in agile environments, testing professionals play an integral role in various quality improvement initiatives throughout each development cycle. this paper explores the participation of test engineers in unit testing within an industrial context, employing a survey-based research methodology. our findings demonstrate that testing professionals have the potential to strengthen unit testing by collaborating with developers to craft thorough test cases and fostering a culture of mutual learning and cooperation, ultimately contributing to increasing the overall quality of software projects.",2024-03-20
"python fuzzing for trustworthy machine learning frameworks","ilya yegorov, eli kobrin, darya parygina, alexey vishnyakov, andrey fedotov","cryptography and security","ensuring the security and reliability of machine learning frameworks is crucial for building trustworthy ai-based systems. fuzzing, a popular technique in secure software development lifecycle (ssdlc), can be used to develop secure and robust software. popular machine learning frameworks such as pytorch and tensorflow are complex and written in multiple programming languages including c/c++ and python. we propose a dynamic analysis pipeline for python projects using the sydr-fuzz toolset. our pipeline includes fuzzing, corpus minimization, crash triaging, and coverage collection. crash triaging and severity estimation are important steps to ensure that the most critical vulnerabilities are addressed promptly. furthermore, the proposed pipeline is integrated in gitlab ci. to identify the most vulnerable parts of the machine learning frameworks, we analyze their potential attack surfaces and develop fuzz targets for pytorch, tensorflow, and related projects such as h5py. applying our dynamic analysis pipeline to these targets, we were able to discover 3 new bugs and propose fixes for them.",2024-03-19
"on the effectiveness of large language models for github workflows","xinyu zhang, siddharth muralee, sourag cherupattamoolayil, aravind machiry","software engineering","github workflows or github ci is a popular continuous integration platform that enables developers to automate various software engineering tasks by specifying them as workflows, i.e., yaml files with a list of jobs. however, engineering valid workflows is tedious. they are also prone to severe security issues, which can result in supply chain vulnerabilities. recent advancements in large language models (llms) have demonstrated their effectiveness in various software development tasks. however, github workflows differ from regular programs in both structure and semantics. we perform the first comprehensive study to understand the effectiveness of llms on five workflow-related tasks with different levels of prompts. we curated a set of $\sim$400k workflows and generated prompts with varying detail. we also fine-tuned llms on github workflow tasks. our evaluation of three state-of-the-art llms and their fine-tuned variants revealed various interesting findings on the current effectiveness and drawbacks of llms.",2024-03-19
"advancing quantum software engineering: a vision of hybrid full-stack iterative model","arif ali khan, davide taibi, cécile m. perrault, asif ali khan","software engineering","this paper introduces a vision for quantum software development lifecycle, proposing a hybrid full-stack iterative model that integrates quantum and classical computing. addressing the current challenges in quantum computing (qc) such as the need for integrating diverse programming languages and managing the complexities of quantum-classical systems, this model is rooted in the principles of devops and continuous software engineering. it presents a comprehensive lifecycle for quantum software development, encompassing quantum-agnostic coding, testing, deployment, cloud computing services, orchestration, translation, execution, and interpretation phases. each phase is designed to accommodate the unique demands of qc, enabling traditional software developers to engage with qc environments without needing in-depth qc expertise. the paper presents a detailed implementation roadmap, utilizing a range of existing tools and frameworks, thereby making quantum software development more accessible and efficient. the proposed model not only addresses current challenges in quantum software development but also makes a substantial contribution to the field of quantum software engineering (qse). by proposing a structured and accessible model, it sets the stage for further advancements and research in qse, enhancing its practicality and relevance in a wide range of applications.",2024-03-18
"jaxdecompiler: redefining gradient-informed software design","pierrick pochelu","programming languages","among numerical libraries capable of computing gradient descent optimization, jax stands out by offering more features, accelerated by an intermediate representation known as jaxpr language. however, editing the jaxpr code is not directly possible. this article introduces jaxdecompiler, a tool that transforms any jax function into an editable python code, especially useful for editing the jax function generated by the gradient function. jaxdecompiler simplifies the processes of reverse engineering, understanding, customizing, and interoperability of software developed by jax. we highlight its capabilities, emphasize its practical applications especially in deep learning and more generally gradient-informed software, and demonstrate that the decompiled code speed performance is similar to the original.",2024-03-14
"an empirical study on developers shared conversations with chatgpt in github pull requests and issues","huizi hao, kazi amit hasan, hong qin, marcos macedo, yuan tian, steven h. h. ding, ahmed e. hassan","software engineering","chatgpt has significantly impacted software development practices, providing substantial assistance to developers in a variety of tasks, including coding, testing, and debugging. despite its widespread adoption, the impact of chatgpt as an assistant in collaborative coding remains largely unexplored. in this paper, we analyze a dataset of 210 and 370 developers shared conversations with chatgpt in github pull requests (prs) and issues. we manually examined the content of the conversations and characterized the dynamics of the sharing behavior, i.e., understanding the rationale behind the sharing, identifying the locations where the conversations were shared, and determining the roles of the developers who shared them. our main observations are: (1) developers seek chatgpt assistance across 16 types of software engineering inquiries. in both conversations shared in prs and issues, the most frequently encountered inquiry categories include code generation, conceptual questions, how-to guides, issue resolution, and code review. (2) developers frequently engage with chatgpt via multi-turn conversations where each prompt can fulfill various roles, such as unveiling initial or new tasks, iterative follow-up, and prompt refinement. multi-turn conversations account for 33.2% of the conversations shared in prs and 36.9% in issues. (3) in collaborative coding, developers leverage shared conversations with chatgpt to facilitate their role-specific contributions, whether as authors of prs or issues, code reviewers, or collaborators on issues. our work serves as the first step towards understanding the dynamics between developers and chatgpt in collaborative software development and opens up new directions for future research on the topic.",2024-03-15
"gamified gui testing with selenium in the intellij ide: a prototype plugin","giacomo garaccione, tommaso fulcini, paolo stefanut bodnarescul, riccardo coppola, luca ardito","software engineering","software testing is a crucial phase in software development, enabling the detection of issues and defects that may arise during the development process. addressing these issues enhances software applications' quality, reliability, user experience, and performance. graphical user interface (gui) testing, one such technique, involves mimicking a regular user's interactions with an application to identify defects. however, gui testing is often underutilized due to its perceived repetitiveness, error-proneness, and lack of immediate feedback on test quality. in recent years, gamification-incorporating game elements in non-game contexts to boost interest, motivation, and engagement-has gained traction in various fields, including software engineering and education. this paper presents gipgut: a prototype of a gamification plugin for intellij idea, an integrated development environment (ide) that supports scripted gui testing. the plugin enhances testers' engagement with typically monotonous and tedious tasks through achievements, rewards, and profile customization. a preliminary prototype evaluation was conducted with a small group of users to assess its usability and the impact of gamification on the gui testing process. the results indicate high usability and positive reception of the gamification elements. however, due to the limited sample size of participants, further research is necessary to understand the plugin's effectiveness fully.",2024-03-14
"how do machine learning projects use continuous integration practices? an empirical study on github actions","joão helis bernardo, daniel alencar da costa, sérgio queiroz de medeiros, uirá kulesza","software engineering","continuous integration (ci) is a well-established practice in traditional software development, but its nuances in the domain of machine learning (ml) projects remain relatively unexplored. given the distinctive nature of ml development, understanding how ci practices are adopted in this context is crucial for tailoring effective approaches. in this study, we conduct a comprehensive analysis of 185 open-source projects on github (93 ml and 92 non-ml projects). our investigation comprises both quantitative and qualitative dimensions, aiming to uncover differences in ci adoption between ml and non-ml projects. our findings indicate that ml projects often require longer build durations, and medium-sized ml projects exhibit lower test coverage compared to non-ml projects. moreover, small and medium-sized ml projects show a higher prevalence of increasing build duration trends compared to their non-ml counterparts. additionally, our qualitative analysis illuminates the discussions around ci in both ml and non-ml projects, encompassing themes like ci build execution and status, ci testing, and ci infrastructure. these insights shed light on the unique challenges faced by ml projects in adopting ci practices effectively.",2024-03-14
"on stpa for distributed development of safe autonomous driving: an interview study","ali nouri, christian berger, fredrik törner","software engineering","safety analysis is used to identify hazards and build knowledge during the design phase of safety-relevant functions. this is especially true for complex ai-enabled and software intensive systems such as autonomous drive (ad). system-theoretic process analysis (stpa) is a novel method applied in safety-related fields like defense and aerospace, which is also becoming popular in the automotive industry. however, stpa assumes prerequisites that are not fully valid in the automotive system engineering with distributed system development and multi-abstraction design levels. this would inhibit software developers from using stpa to analyze their software as part of a bigger system, resulting in a lack of traceability. this can be seen as a maintainability challenge in continuous development and deployment (devops). in this paper, stpa's different guidelines for the automotive industry, e.g. j31887/iso21448/stpa handbook, are firstly compared to assess their applicability to the distributed development of complex ai-enabled systems like ad. further, an approach to overcome the challenges of using stpa in a multi-level design context is proposed. by conducting an interview study with automotive industry experts for the development of ad, the challenges are validated and the effectiveness of the proposed approach is evaluated.",2024-03-14
"code revert prediction with graph neural networks: a case study at j.p. morgan chase","yulong pei, salwa alamir, rares dolga, sameena shah","software engineering","code revert prediction, a specialized form of software defect detection, aims to forecast or predict the likelihood of code changes being reverted or rolled back in software development. this task is very important in practice because by identifying code changes that are more prone to being reverted, developers and project managers can proactively take measures to prevent issues, improve code quality, and optimize development processes. however, compared to code defect detection, code revert prediction has been rarely studied in previous research. additionally, many previous methods for code defect detection relied on independent features but ignored relationships between code scripts. moreover, new challenges are introduced due to constraints in an industry setting such as company regulation, limited features and large-scale codebase. to overcome these limitations, this paper presents a systematic empirical study for code revert prediction that integrates the code import graph with code features. different strategies to address anomalies and data imbalance have been implemented including graph neural networks with imbalance classification and anomaly detection. we conduct the experiments on real-world code commit data within j.p. morgan chase which is extremely imbalanced in order to make a comprehensive comparison of these different approaches for the code revert prediction problem.",2024-03-14
"an industrial experience report about challenges from continuous monitoring, improvement, and deployment for autonomous driving features","ali nouri, christian berger, fredrik torner","software engineering","using continuous development, deployment, and monitoring (cddm) to understand and improve applications in a customer's context is widely used for non-safety applications such as smartphone apps or web applications to enable rapid and innovative feature improvements. having demonstrated its potential in such domains, it may have the potential to also improve the software development for automotive functions as some oems described on a high level in their financial company communiqus. however, the application of a cddm strategy also faces challenges from a process adherence and documentation perspective as required by safety-related products such as autonomous driving systems (ads) and guided by industry standards such as iso-26262 and iso21448. there are publications on cddm in safety-relevant contexts that focus on safety-critical functions on a rather generic level and thus, not specifically ads or automotive, or that are concentrating only on software and hence, missing out the particular context of an automotive oem: well-established legacy processes and the need of their adaptations, and aspects originating from the role of being a system integrator for software/software, hardware/hardware, and hardware/software. in this paper, particular challenges from the automotive domain to better adopt cddm are identified and discussed to shed light on research gaps to enhance cddm, especially for the software development of safe ads. the challenges are identified from today's industrial well-established ways of working by conducting interviews with domain experts and complemented by a literature study.",2024-03-14
"llm-based agents for automating the enhancement of user story quality: an early report","zheying zhang, maruf rayhan, tomas herda, manuel goisauf, pekka abrahamsson","software engineering","in agile software development, maintaining high-quality user stories is crucial, but also challenging. this study explores the use of large language models to automatically improve the user story quality in austrian post group it agile teams. we developed a reference model for an autonomous llm-based agent system and implemented it at the company. the quality of user stories in the study and the effectiveness of these agents for user story quality improvement was assessed by 11 participants across six agile teams. our findings demonstrate the potential of llms in improving user story quality, contributing to the research on ai role in agile development, and providing a practical example of the transformative impact of ai in an industry setting.",2024-03-14
"qcshqd: quantum computing as a service for hybrid classical-quantum software development: a vision","maryam tavassoli sabzevari, matteo esposito, arif ali khan, davide taibi","software engineering","quantum computing (qc) is transitioning from theoretical frameworks to an indispensable powerhouse of computational capability, resulting in extensive adoption across both industrial and academic domains. qc presents exceptional advantages, including unparalleled processing speed and the potential to solve complex problems beyond the capabilities of classical computers. nevertheless, academic researchers and industry practitioners encounter various challenges in harnessing the benefits of this technology. the limited accessibility of qc resources for classical developers, and a general lack of domain knowledge and expertise, represent insurmountable barrier, hence to address these challenges, we introduce a framework- quantum computing as a service for hybrid classical-quantum software development (qcshqd), which leverages service-oriented strategies. our framework comprises three principal components: an integrated development environment (ide) for user interaction, an abstraction layer dedicated to orchestrating quantum services, and a service provider responsible for executing services on quantum computer. this study presents a blueprint for qcshqd, designed to democratize access to qc resources for classical developers who want to seamless harness qc power. the vision of qcshqd paves the way for groundbreaking innovations by addressing key challenges of hybridization between classical and quantum computers.",2024-03-13
