"title","author","subject","abstract","date"
"bridging gaps, building futures: advancing software developer diversity and inclusion through future-oriented research","sonja m. hyrynsalmi, sebastian baltes, chris brown, rafael prikladnicki, gema rodriguez-perez, alexander serebrenik, jocelyn simmonds, bianca trinkenreich, yi wang, grischa liebel","software engineering","software systems are responsible for nearly all aspects of modern life and society. however, the demographics of software development teams that are tasked with designing and maintaining these software systems rarely match the demographics of users. as the landscape of software engineering (se) evolves due to technological innovations, such as the rise of automated programming assistants powered by artificial intelligence (ai) and machine learning, more effort is needed to promote software developer diversity and inclusion (sddi) to ensure inclusive work environments for development teams and usable software for diverse populations. to this end, we present insights from se researchers and practitioners on challenges and solutions regarding diversity and inclusion in se. based on these findings, we share potential utopian and dystopian visions of the future and provide future research directions and implications for academia and industry to promote sddi in the age of ai-driven se.",2024-04-10
"on test sequence generation using multi-objective particle swarm optimization","zain iqbal, kashif zafar, aden iqbal, ayesha khan","software engineering","software testing is an important and essential part of the software development life cycle and accounts for almost one-third of system development costs. in the software industry, testing costs can account for about 35% to 40% of the total cost of a software project. therefore, providing efficient ways to test software is critical to reduce cost, time, and effort. black-box testing and white-box testing are two essential components of software testing. black-box testing focuses on the software's functionality, while white-box testing examines its internal structure. these tests contribute significantly to ensuring program coverage, which remains one of the main goals of the software testing paradigm. one of the main problems in this area is the identification of appropriate paths for program coverage, which are referred to as test sequences. creating an automated and effective test sequence is a challenging task in the software testing process. in the proposed methodology, the challenge of ""test sequence generation"" is considered a multi-objective optimization problem that includes the oracle cost and the path, both of which are optimized in a symmetrical manner to achieve optimal software testing. multi-objective particle swarm optimization (mopso) is used to represent the test sequences with the highest priority and the lowest oracle cost as optimal. the performance of the implemented approach is compared with the multi-objective firefly algorithm (mofa) for generating test sequences. the mopso-based solution outperforms the mofa-based approach and simultaneously provides the optimal solution for both objectives.",2024-04-09
"public-private funding models in open source software development: a case study on scikit-learn","cailean osborne","software engineering","governments are increasingly funding open source software (oss) development to support software security, digital sovereignty, and national competitiveness in science and innovation, amongst others. however, little is known about how oss developers evaluate the relative benefits and drawbacks of emergent governmental funding for oss. this paper explores this question through a case study on scikit-learn, a popular python library for machine learning, which has been funded by public research grants, commercial sponsorship, micro-donations, and a 32 million euro grant announced in france's artificial intelligence strategy. through 25 interviews with scikit-learn's maintainers and funders, this study makes two key contributions to research and practice. first, it contributes novel empirical findings on the effective design and implementation of a public-private funding model in an oss project, as well as how the maintainers of scikit-learn have designed and employed governance protocols to balance the diverse interests of their funders and to safeguard their community ethos. second, it offers practical lessons on funding in community-led oss projects and makes recommendations to practitioners. the paper concludes with a discussion of the key recommendations.",2024-04-09
"a rag method for source code inquiry tailored to long-context llms","toshihiro kamiya","software engineering","although the context length limitation of large language models (llms) has been mitigated, it still hinders their application to software development tasks. this study proposes a method incorporating execution traces into rag for inquiries about source code. small-scale experiments confirm a tendency for the method to contribute to improving llm response quality.",2024-04-09
"kamping: flexible and (near) zero-overhead c++ bindings for mpi","demian hespe, lukas hübner, florian kurpicz, peter sanders, matthias schimek, daniel seemaier, christoph stelz, tim niklas uhl","distributed, parallel, and cluster computing","the message-passing interface (mpi) and c++ form the backbone of high-performance computing, but mpi only provides c and fortran bindings. while this offers great language interoperability, high-level programming languages like c++ make software development quicker and less error-prone.
we propose novel c++ language bindings that cover all abstraction levels from low-level mpi calls to convenient stl-style bindings, where most parameters are inferred from a small subset of parameters, by bringing named parameters to c++. this enables rapid prototyping and fine-tuning runtime behavior and memory management. a flexible type system and additional safeness guarantees help to prevent programming errors.
by exploiting c++'s template-metaprogramming capabilities, this has (near) zero-overhead, as only required code paths are generated at compile time.
we demonstrate that our library is a strong foundation for a future distributed standard library using multiple application benchmarks, ranging from text-book sorting algorithms to phylogenetic interference.",2024-04-08
"synergy of large language model and model driven engineering for automated development of centralized vehicular systems","nenad petrovic, fengjunjie pan, krzysztof lebioda, vahid zolfaghari, sven kirchner, nils purschke, muhammad aqib khan, viktor vorobev, alois knoll","software engineering","we present a prototype of a tool leveraging the synergy of model driven engineering (mde) and large language models (llm) for the purpose of software development process automation in the automotive industry. in this approach, the user-provided input is free form textual requirements, which are first translated to ecore model instance representation using an llm, which is afterwards checked for consistency using object constraint language (ocl) rules. after successful consistency check, the model instance is fed as input to another llm for the purpose of code generation. the generated code is evaluated in a simulated environment using carla simulator connected to an example centralized vehicle architecture, in an emergency brake scenario.",2024-04-08
"autocoderover: autonomous program improvement","yuntong zhang, haifeng ruan, zhiyu fan, abhik roychoudhury","software engineering","researchers have made significant progress in automating the software development process in the past decades. recent progress in large language models (llms) has significantly impacted the development process, where developers can use llm-based programming assistants to achieve automated coding. nevertheless software engineering involves the process of program improvement apart from coding, specifically to enable software maintenance (e.g. bug fixing) and software evolution (e.g. feature additions). in this paper, we propose an automated approach for solving github issues to autonomously achieve program improvement. in our approach called autocoderover, llms are combined with sophisticated code search capabilities, ultimately leading to a program modification or patch. in contrast to recent llm agent approaches from ai researchers and practitioners, our outlook is more software engineering oriented. we work on a program representation (abstract syntax tree) as opposed to viewing a software project as a mere collection of files. our code search exploits the program structure in the form of classes/methods to enhance llm's understanding of the issue's root cause, and effectively retrieve a context via iterative search. the use of spectrum based fault localization using tests, further sharpens the context, as long as a test-suite is available. experiments on swe-bench-lite which consists of 300 real-life github issues show increased efficacy in solving github issues (22-23% on swe-bench-lite). on the full swe-bench consisting of 2294 github issues, autocoderover solved around 16% of issues, which is higher than the efficacy of the recently reported ai software engineer devin from cognition labs, while taking time comparable to devin. we posit that our workflow enables autonomous software engineering, where, in future, auto-generated code from llms can be autonomously improved.",2024-04-08
"ai for devsecops: a landscape and future opportunities","michael fu, jirat pasuksmit, chakkrit tantithamthavorn","software engineering","devops has emerged as one of the most rapidly evolving software development paradigms. with the growing concerns surrounding security in software systems, the devsecops paradigm has gained prominence, urging practitioners to incorporate security practices seamlessly into the devops workflow. however, integrating security into the devops workflow can impact agility and impede delivery speed. recently, the advancement of artificial intelligence (ai) has revolutionized automation in various software domains, including software security. ai-driven security approaches, particularly those leveraging machine learning or deep learning, hold promise in automating security workflows. they reduce manual efforts, which can be integrated into devops to ensure uninterrupted delivery speed and align with the devsecops paradigm simultaneously. this paper seeks to contribute to the critical intersection of ai and devsecops by presenting a comprehensive landscape of ai-driven security techniques applicable to devops and identifying avenues for enhancing security, trust, and efficiency in software development processes. we analyzed 99 research papers spanning from 2017 to 2023. specifically, we address two key research questions (rqs). in rq1, we identified 12 security tasks associated with the devops process and reviewed existing ai-driven security approaches. in rq2, we discovered 15 challenges encountered by existing ai-driven security approaches and derived future research opportunities. drawing insights from our findings, we discussed the state-of-the-art ai-driven security approaches, highlighted challenges in existing research, and proposed avenues for future opportunities.",2024-04-07
"search-based automated program repair of cps controllers modeled in simulink-stateflow","aitor arrieta, pablo valle, shaukat ali","software engineering","stateflow models are widely used in the industry to model the high-level control logic of cyber-physical systems (cpss) in simulink--the defacto cps simulator. many approaches exist to test simulink models, but once a fault is detected, the process to repair it remains manual. such a manual process increases the software development cost, making it paramount to develop novel techniques that reduce this cost. automated program repair (apr) techniques can significantly reduce the time for fixing bugs by automatically generating patches. however, current approaches face scalability issues to be applicable in the cps context. to deal with this problem, we propose an automated search-based approach called flowrepair, explicitly designed to repair stateflow models. the novelty of flowrepair includes, (1) a new algorithm that combines global and local search for patch generation; (2) a definition of novel repair objectives (e.g., the time a fault remained active) specifically designed for repairing cpss; and (3) a set of mutation operators to repair stateflow models automatically. we evaluated flowrepair with three different case study systems and a total of nine faulty stateflow models. our experiments suggest that (1) flo wrepaircan fix bugs in stateflow models, including models with multiple faults; (2) flowrepair surpasses or performs similarly to a baseline apr technique inspired by a well-known cps program repair approach. besides, we provide both a replication package and a live repository, paving the way towards the apr of cpss modeled in simulink.",2024-04-06
"towards understanding the impact of code modifications on software quality metrics","thomas karanikiotis, andreas l. symeonidis","software engineering","context: in the realm of software development, maintaining high software quality is a persistent challenge. however, this challenge is often impeded by the lack of comprehensive understanding of how specific code modifications influence quality metrics.
objective: this study ventures to bridge this gap through an approach that aspires to assess and interpret the impact of code modifications. the underlying hypothesis posits that code modifications inducing similar changes in software quality metrics can be grouped into distinct clusters, which can be effectively described using an ai language model, thus providing a simple understanding of code changes and their quality implications.
method: to validate this hypothesis, we built and analyzed a dataset from popular github repositories, segmented into individual code modifications. each project was evaluated against software quality metrics pre and post-application. machine learning techniques were utilized to cluster these modifications based on the induced changes in the metrics. simultaneously, an ai language model was employed to generate descriptions of each modification's function.
results: the results reveal distinct clusters of code modifications, each accompanied by a concise description, revealing their collective impact on software quality metrics.
conclusions: the findings suggest that this research is a significant step towards a comprehensive understanding of the complex relationship between code changes and software quality, which has the potential to transform software maintenance strategies and enable the development of more accurate quality prediction models.",2024-04-05
"x-lifecycle learning for cloud incident management using llms","drishti goel, fiza husain, aditya singh, supriyo ghosh, anjaly parayil, chetan bansal, xuchao zhang, saravan rajmohan","networking and internet architecture","incident management for large cloud services is a complex and tedious process and requires significant amount of manual efforts from on-call engineers (oces). oces typically leverage data from different stages of the software development lifecycle [sdlc] (e.g., codes, configuration, monitor data, service properties, service dependencies, trouble-shooting documents, etc.) to generate insights for detection, root causing and mitigating of incidents. recent advancements in large language models [llms] (e.g., chatgpt, gpt-4, gemini) created opportunities to automatically generate contextual recommendations to the oces assisting them to quickly identify and mitigate critical issues. however, existing research typically takes a silo-ed view for solving a certain task in incident management by leveraging data from a single stage of sdlc. in this paper, we demonstrate that augmenting additional contextual data from different stages of sdlc improves the performance of two critically important and practically challenging tasks: (1) automatically generating root cause recommendations for dependency failure related incidents, and (2) identifying ontology of service monitors used for automatically detecting incidents. by leveraging 353 incident and 260 monitor dataset from microsoft, we demonstrate that augmenting contextual information from different stages of the sdlc improves the performance over state-of-the-art methods.",2024-02-15
"codeeditorbench: evaluating code editing capability of large language models","jiawei guo, ziming li, xueling liu, kaijing ma, tianyu zheng, zhouliang yu, ding pan, yizhi li, ruibo liu, yue wang, shuyue guo, xingwei qu, xiang yue, ge zhang, wenhu chen, jie fu","software engineering","large language models (llms) for code are rapidly evolving, with code editing emerging as a critical capability. we introduce codeeditorbench, an evaluation framework designed to rigorously assess the performance of llms in code editing tasks, including debugging, translating, polishing, and requirement switching. unlike existing benchmarks focusing solely on code generation, codeeditorbench emphasizes real-world scenarios and practical aspects of software development. we curate diverse coding challenges and scenarios from five sources, covering various programming languages, complexity levels, and editing tasks. evaluation of 19 llms reveals that closed-source models (particularly gemini-ultra and gpt-4), outperform open-source models in codeeditorbench, highlighting differences in model performance based on problem types and prompt sensitivities. codeeditorbench aims to catalyze advancements in llms by providing a robust platform for assessing code editing capabilities. we will release all prompts and datasets to enable the community to expand the dataset and benchmark emerging llms. by introducing codeeditorbench, we contribute to the advancement of llms in code editing and provide a valuable resource for researchers and practitioners.",2024-04-04
"enhancing student engagement in large-scale capstone courses: an experience report","asma shakil, paul denny","computers and society","computer science (cs) capstone courses offer students a valuable opportunity to gain hands-on experience in software development, practice essential soft skills, and enhance their employability prospects. they are a core component in many cs undergraduate degrees and address the acm curricula requirements of inculcating professional dispositions in students and making them aware of the broader societal implications of computing. however, coordinating a capstone course, especially for a large student cohort, can be a daunting task for academic staff. it demands considerable time and energy for planning and coordinating activities between students, academic staff, and any external stakeholders. in this experience report, we outline the iterative development and refinement of our capstone course as it grew substantially in size over a span of six consecutive sessions. we outline the pedagogies that helped us to enhance student engagement and motivation in the course as assessed by end-of-course surveys and students' written reflections. we share the lessons that we have learnt and provide recommendations to educators who are designing new capstone courses or looking to scale existing ones.",2024-04-03
"self-organized agents: a llm multi-agent framework toward ultra large-scale code generation and optimization","yoichi ishibashi, yoshimasa nishimura","software engineering","recent advancements in automatic code generation using large language model (llm) agent have brought us closer to the future of automated software development. however, existing single-agent approaches face limitations in generating and improving large-scale, complex codebases due to constraints in context length. to tackle this challenge, we propose self-organized multi-agent framework (soa), a novel multi-agent framework that enables the scalable and efficient generation and optimization of large-scale code. in soa, self-organized agents operate independently to generate and modify code components while seamlessly collaborating to construct the overall codebase. a key feature of our framework is the automatic multiplication of agents based on problem complexity, allowing for dynamic scalability. this enables the overall code volume to be increased indefinitely according to the number of agents, while the amount of code managed by each agent remains constant. we evaluate soa on the humaneval benchmark and demonstrate that, compared to a single-agent system, each agent in soa handles significantly less code, yet the overall generated code is substantially greater. moreover, soa surpasses the powerful single-agent baseline by 5% in terms of pass@1 accuracy.",2024-04-02
"an exploratory study of the relationship between satd and other software development activities","shima esfandiari, ashkan sami","software engineering","technical debt is a common issue that arises when short-term gains are prioritized over long-term costs, leading to a degradation in the quality of the code. self-admitted technical debt (satd) is a specific type of technical debt that involves documenting code to remind developers of its debt. previous research has explored various aspects of satd, including detection methods, distribution, and its impact on software quality. to better understand satd, one comprehension technique is to examine its co-occurrence with other activities, such as refactoring and bug fixing. this study investigates the relationship between removing and adding satd and activities such as refactoring, bug fixing, adding new features, and testing. to do so, we analyzed 77 open-source java projects using todo/fixme/xxx removal or addition in inline comments as indicators of satd. we examined the co-occurrence of satd with each activity in each project through chi-square and odds ratio evaluations. our results show that satd removal occurs simultaneously with refactoring in 95% of projects, while its addition occurs in 89% of projects. furthermore, we found that three types of refactoring - ""move class"", ""remove method"", and ""move attribute"" - occur more frequently in the presence of satd. however, their distribution is similar in projects with and without satd.",2024-04-02
"automated user story generation with test case specification using large language model","tajmilur rahman, yuecai zhu","software engineering","modern software engineering era is moving fast with the assistance of artificial intelligence (ai), especially large language models (llm). researchers have already started automating many parts of the software development workflow. requirements engineering (re) is a crucial phase that begins the software development cycle through multiple discussions on a proposed scope of work documented in different forms. re phase ends with a list of user-stories for each unit task identified through discussions and usually these are created and tracked on a project management tool such as jira, azurdev etc. in this research we developed a tool ""geneus"" using gpt-4.0 to automatically create user stories from requirements document which is the outcome of the re phase. the output is provided in json format leaving the possibilities open for downstream integration to the popular project management tools. analyzing requirements documents takes significant effort and multiple meetings with stakeholders. we believe, automating this process will certainly reduce additional load off the software engineers, and increase the productivity since they will be able to utilize their time on other prioritized tasks.",2024-04-02
"octopus: on-device language model for function calling of software apis","wei chen, zhiyuan li, mingyuan ma","computation and language","in the rapidly evolving domain of artificial intelligence, large language models (llms) play a crucial role due to their advanced text processing and generation abilities. this study introduces a new strategy aimed at harnessing on-device llms in invoking software apis. we meticulously compile a dataset derived from software api documentation and apply fine-tuning to llms with capacities of 2b, 3b and 7b parameters, specifically to enhance their proficiency in software api interactions. our approach concentrates on refining the models' grasp of api structures and syntax, significantly enhancing the accuracy of api function calls. additionally, we propose \textit{conditional masking} techniques to ensure outputs in the desired formats and reduce error rates while maintaining inference speeds. we also propose a novel benchmark designed to evaluate the effectiveness of llms in api interactions, establishing a foundation for subsequent research. octopus, the fine-tuned model, is proved to have better performance than gpt-4 for the software apis calling. this research aims to advance automated software development and api integration, representing substantial progress in aligning llm capabilities with the demands of practical software engineering applications.",2024-04-02
